{
 "bnapCases": 1,
 "area": "offer",
 "title": "The Offer",
 "schema": "schema/offer.schema.json",
 "generator": "conformance/gen_cases.py",
 "source": "spec/socket-draft-00.md (doc rev 39), spec/ERRATA.md, spec/DECISIONS.md, registry/generated/registry.json, reference/python/bnap_ref.py",
 "numberOfTests": 139,
 "header": [
  "Offers are TLV streams signed by an online offer key (draft-00 section 4).",
  "Offers are signed with SHA-256(\"bnap test offer key\"), as in vectors.json, and carry a MAC",
  "under SHA-256(\"bnap test mac key\") unless the case says otherwise. Times are Unix seconds;",
  "every expiry check allows 60 seconds of skew. A client cannot check the MAC."
 ],
 "notes": {
  "Valid": {
   "bugType": "BASIC",
   "description": "A well-formed input every implementation must accept."
  },
  "Structure": {
   "bugType": "MALFORMED",
   "description": "A record missing, of the wrong length or with a bad value."
  },
  "Version": {
   "bugType": "VERSION",
   "description": "An unsupported socket version."
  },
  "Size": {
   "bugType": "TOO_LARGE",
   "description": "Over the size limit."
  },
  "ClassRule": {
   "bugType": "MALFORMED",
   "description": "An offer no gate may build: a binding-class, metering or quota rule of 4.3, 7, 12 or DECISIONS row 25 is broken. No socket code names this; the cases use MALFORMED, the code a validator reports."
  },
  "Signature": {
   "bugType": "BAD_OFFER",
   "description": "offer_sig does not verify, or the key is not trusted."
  },
  "Mac": {
   "bugType": "BAD_OFFER",
   "description": "The MAC does not verify under any current or retained key."
  },
  "Expired": {
   "bugType": "STALE",
   "description": "Expired, or issued in the future, beyond the 60 s skew."
  },
  "Skew": {
   "bugType": "EDGE",
   "description": "Exactly at the edge of the 60 s skew allowance."
  },
  "Scope": {
   "bugType": "WRONG_SCOPE",
   "description": "The offer names another action or route."
  },
  "NotOffered": {
   "bugType": "NOT_OFFERED",
   "description": "The credential uses a scheme the offer does not list."
  },
  "Order": {
   "bugType": "EDGE",
   "description": "Two faults at once: the 4.4 order decides the code."
  },
  "Tofu": {
   "bugType": "EDGE",
   "description": "No pinned manifest: the client trusts on first use."
  },
  "Advance": {
   "bugType": "EDGE",
   "description": "An offer published in advance: no MAC, issued_at, a key the gate holds."
  },
  "UnknownScheme": {
   "bugType": "BASIC",
   "description": "An entry whose scheme the client does not know, which it ignores."
  },
  "UnknownOdd": {
   "bugType": "BASIC",
   "description": "An unknown odd record, ignored by the receiver."
  },
  "Native": {
   "bugType": "BASIC",
   "description": "Native entries and OfferID invariance."
  }
 },
 "testGroups": [
  {
   "type": "OfferParse",
   "section": "4.1",
   "description": "Parse an offer and apply every record rule of 4.1.",
   "tests": [
    {
     "tcId": 1,
     "comment": "draft-00 section 14 route offer",
     "flags": [
      "Valid"
     ],
     "sections": [
      "4.1"
     ],
     "inputs": {
      "offer": "0001010220862d641e67813f6e78b20a81aa929519e66a978e69e8a4d3e27280990697f3a0040008000a046acb2d4c0c2468747470733a2f2f6170692e6578616d706c652f2e77656c6c2d6b6e6f776e2f626e61700e20b28dad5f717c5144bdb0aa6db94bb6c79afa9b8bd9bc84825a2c1baafe64add91010000102030405060708090a0b0c0d0e0f121a19000a626e61703a6e6f7465730202083404037361740a0201f4141e1d0014687474707369673a7765622d626f742d61757468020102040207d0f040fa3a850dff40a2fe54f5662580783b3e4d63fbc3a99ea4832465d60427d849cf31d35c759da7958591b12c2fc51a4aee30288636999720a9813b714d996d2d3af220a29714a6310d1153b6477c0a06e297d0d18f614a52d2bf31926900693620fc13feb2d05e01020a0a",
      "max_offer": 4096
     },
     "result": "valid",
     "expected": {
      "offer_id": "5c8640261f6f1de3206a2e9cd1c2599a2e9256547242061c95f9d2e06cf6696d",
      "pay": [
       "bnap:notes"
      ],
      "attest": [
       [
        "httpsig:web-bot-auth",
        "discount"
       ]
      ],
      "route_scope": true,
      "metered": true,
      "ignored": [
       3000000001
      ]
     }
    },
    {
     "tcId": 2,
     "comment": "draft-00 section 14 exact offer without native",
     "flags": [
      "Valid"
     ],
     "sections": [
      "4.1"
     ],
     "inputs": {
      "offer": "000101022002be38b55551b02bee2daab2ca3d752e9538cc288f57a6dea67ccaf6971b37170a046acb2d4c0e20b28dad5f717c5144bdb0aa6db94bb6c79afa9b8bd9bc84825a2c1baafe64add910100000000000000000000000000000000012232200187061796d656e743a6c696768746e696e672f6368617267650201150403736174f040dfce109de606bd4bc597d3c88ef1b6dbe27176565d43e4dc2085e7b454f9ba83c63dac273f1097d26fc2744524eadc231f449a6a72230bd7a64d778edaa31e13f220f712cf076123b3454eacb75b140ed905a80601964b81d0d8102895e5c1f737df",
      "max_offer": 4096
     },
     "result": "valid",
     "expected": {
      "offer_id": "919103b562f6bc331a6bdfb9144711fd2fe6d17665a28c0e38dfb3f56a2e7562",
      "pay": [
       "payment:lightning/charge"
      ],
      "attest": [],
      "route_scope": false,
      "metered": false,
      "ignored": []
     }
    },
    {
     "tcId": 3,
     "comment": "draft-00 section 14 exact offer with native",
     "flags": [
      "Native"
     ],
     "sections": [
      "4.1"
     ],
     "inputs": {
      "offer": "000101022002be38b55551b02bee2daab2ca3d752e9538cc288f57a6dea67ccaf6971b37170a046acb2d4c0e20b28dad5f717c5144bdb0aa6db94bb6c79afa9b8bd9bc84825a2c1baafe64add910100000000000000000000000000000000012232200187061796d656e743a6c696768746e696e672f63686172676502011504037361741a242300000206626f6c74313104176c6e62633231306e312e2e2e706c616365686f6c646572f0409cc8071d52049dfdbf05e42d5884ae6fdf08b1b68d891bfbb39a4e5b96bdc45a7f6e102c50ea0e8c866bdac1db147837458f231c94df4ba6ee73773a37f21467f220331c67bae9ffebb79aafe340d6a0f5bbad252dc20448ae03686dd93d829e0399",
      "max_offer": 4096
     },
     "result": "valid",
     "expected": {
      "offer_id": "919103b562f6bc331a6bdfb9144711fd2fe6d17665a28c0e38dfb3f56a2e7562",
      "pay": [
       "payment:lightning/charge"
      ],
      "attest": [],
      "route_scope": false,
      "metered": false,
      "ignored": []
     }
    },
    {
     "tcId": 4,
     "comment": "draft-00 section 14 attestation-only offer (waive, no pay)",
     "flags": [
      "Valid"
     ],
     "sections": [
      "4.1"
     ],
     "inputs": {
      "offer": "000101022002be38b55551b02bee2daab2ca3d752e9538cc288f57a6dea67ccaf6971b37170a046acb2d4c0e20b28dad5f717c5144bdb0aa6db94bb6c79afa9b8bd9bc84825a2c1baafe64add9101001010101010101010101010101010101141312000d68747470617574683a44506f50020101f040bbe949421f0856526626da427f496f92b4f6ebd36ee5f14f8e9e0f469cf83fda4f3836cc38b29329c1e4903aac247869163f8385e545493c9e1a63c7b217f3b6f2200af44dfe41ea08556d334e8cd8abfac399d0c192792363f3109a28a549dda17c",
      "max_offer": 4096
     },
     "result": "valid",
     "expected": {
      "offer_id": "2511ffa46367c79758fe8920996dddd1098ec6aac0bf9e04ae943940f3dadfc8",
      "pay": [],
      "attest": [
       [
        "httpauth:DPoP",
        "waive"
       ]
      ],
      "route_scope": false,
      "metered": false,
      "ignored": []
     }
    },
    {
     "tcId": 5,
     "comment": "version 2",
     "flags": [
      "Version"
     ],
     "sections": [
      "4.1"
     ],
     "inputs": {
      "offer": "00010202200c5c339b0fc7426f88736cda459f84cf13c7a58dad26de49d2987a155e1eaf960a046acb2d4c0e20b28dad5f717c5144bdb0aa6db94bb6c79afa9b8bd9bc84825a2c1baafe64add910100707070707070707070707070707070712232200187061796d656e743a6c696768746e696e672f6368617267650201150403736174f040c9276fb356ec46b5696a93a9e892c0e1ad6d5e952bf41634cf0de23be78a69078b0fbf8e73763dfef8b1eb5c9b75c647a9dc94454b3725002e659567037e2a47f22007d289330b30d81aef5d659a1ff5e36d0268d3090fb029699c1b7ab564c46bec",
      "max_offer": 4096
     },
     "result": "invalid",
     "error": "VERSION",
     "errorCode": 1
    },
    {
     "tcId": 6,
     "comment": "version written with a leading zero byte",
     "flags": [
      "Structure"
     ],
     "sections": [
      "4.1"
     ],
     "inputs": {
      "offer": "0002000102200c5c339b0fc7426f88736cda459f84cf13c7a58dad26de49d2987a155e1eaf960a046acb2d4c0e20b28dad5f717c5144bdb0aa6db94bb6c79afa9b8bd9bc84825a2c1baafe64add910100707070707070707070707070707070712232200187061796d656e743a6c696768746e696e672f6368617267650201150403736174f0404bd959fcb01a348be218a4aa6a712f2e4bb4a53d638036d00a809dd191cce3bcbb636619d0491e729aaa290591f79aa9b8b343f31070ec4278e31c972af68e20f220edec46c91b8a9dc066e264b0897a432636e130242fc6c2487e15f3740d14c7e1",
      "max_offer": 4096
     },
     "result": "invalid",
     "error": "MALFORMED",
     "errorCode": 2
    },
    {
     "tcId": 7,
     "comment": "version record missing",
     "flags": [
      "Structure"
     ],
     "sections": [
      "4.1"
     ],
     "inputs": {
      "offer": "02200c5c339b0fc7426f88736cda459f84cf13c7a58dad26de49d2987a155e1eaf960a046acb2d4c0e20b28dad5f717c5144bdb0aa6db94bb6c79afa9b8bd9bc84825a2c1baafe64add910100707070707070707070707070707070712232200187061796d656e743a6c696768746e696e672f6368617267650201150403736174f040753373960e65f145398606e72a078458287d7d7a0fa25666827b648b0d85b3209102af1e1051ec80f2abbda3991a5852c7c92d8a4d2f3b83784d9d99f3662cd3f2200dd0deea1402e392e78766c797918e5c35a9cefde565b2a4257116e5fbacf893",
      "max_offer": 4096
     },
     "result": "invalid",
     "error": "MALFORMED",
     "errorCode": 2
    },
    {
     "tcId": 8,
     "comment": "scope missing",
     "flags": [
      "Structure"
     ],
     "sections": [
      "4.1"
     ],
     "inputs": {